{
  "$schema": "http://json-schema.org/draft-07/schema#",
  "$id": "https://x402.org/schemas/domain-discovery.schema.json",
  "title": "x402 Domain Discovery Manifest",
  "description": "Authoritative RFC 8615 well-known domain discovery manifest for x402 payment-enabled origins (/.well-known/x402).",
  "type": "object",
  "properties": {
    "x402Version": {
      "$ref": "#/definitions/protocolVersion"
    },
    "kind": {
      "description": "The operational role of this host in the x402 topology.",
      "oneOf": [
        {
          "type": "string",
          "enum": ["resource-server", "facilitator", "both"]
        },
        {
          "type": "array",
          "items": {
            "type": "string",
            "enum": ["resource-server", "facilitator", "both"]
          },
          "minItems": 1,
          "uniqueItems": true
        }
      ]
    },
    "facilitator": {
      "type": "string",
      "format": "uri",
      "description": "Optional URI pointing to an external authoritative facilitator service."
    },
    "keys": {
      "type": "array",
      "description": "Host-level cryptographic public keys for manifest and challenge signature verification.",
      "items": {
        "$ref": "#/definitions/verificationKey"
      }
    },
    "extensions": {
      "type": "object",
      "description": "Optional container for experimental, forward-compatible, or vendor-specific extension payloads without violating root schema determinism."
    },
    "resources": {
      "type": "array",
      "description": "Payment-enabled endpoints and services served by this host.",
      "items": {
        "$ref": "#/definitions/resourceEndpoint"
      }
    },
    "openapi": {
      "description": "Optional pointer to developer documentation and OpenAPI descriptions. Strictly informational; payment discovery is resolved directly via resources.",
      "oneOf": [
        {
          "type": "string",
          "format": "uri"
        },
        {
          "type": "array",
          "items": {
            "type": "string",
            "format": "uri"
          },
          "minItems": 1
        }
      ]
    }
  },
  "not": {
    "anyOf": [
      { "required": ["accepts"] },
      { "required": ["payTo"] },
      { "required": ["networks"] },
      { "required": ["fee"] },
      { "required": ["access"] }
    ],
    "description": "Payment carriers MUST be declared per-resource inside resources[].accepts[], never at the document root."
  },
  "anyOf": [
    {
      "required": ["resources"],
      "description": "Resource servers declare the resources array."
    },
    {
      "properties": {
        "kind": {
          "oneOf": [
            { "enum": ["facilitator", "both"] },
            {
              "type": "array",
              "contains": { "enum": ["facilitator", "both"] }
            }
          ]
        }
      },
      "required": ["kind"],
      "description": "Hosts acting as standalone or hybrid facilitators may omit the resources array."
    },
    {
      "required": ["openapi"],
      "description": "Hosts declaring OpenAPI documentation pointers during the migration phase."
    }
  ],
  "if": {
    "not": {
      "required": ["resources"],
      "properties": {
        "resources": {
          "type": "array",
          "minItems": 1,
          "items": {
            "not": {
              "type": "object",
              "anyOf": [
                { "required": ["path"] },
                { "required": ["accepts"] }
              ],
              "not": {
                "required": ["x402Version"]
              }
            }
          }
        }
      }
    }
  },
  "then": {
    "required": ["x402Version"]
  },
  "additionalProperties": true,
  "definitions": {
    "protocolVersion": {
      "type": "integer",
      "enum": [2],
      "description": "The x402 protocol specification version. Must be 2."
    },
    "atomicAmount": {
      "type": "string",
      "pattern": "^[0-9]+$",
      "description": "Non-negative integer string representing asset quantity in its smallest atomic denomination (e.g. satoshis, base units)."
    },
    "verificationKey": {
      "type": "object",
      "required": [
        "kid",
        "alg",
        "publicKey"
      ],
      "properties": {
        "kid": {
          "type": "string",
          "minLength": 1,
          "description": "Key identifier, matching DNS TXT ground truth records."
        },
        "alg": {
          "type": "string",
          "enum": ["Ed25519", "ES256", "ES256K"],
          "description": "Cryptographic signature algorithm."
        },
        "publicKey": {
          "type": "string",
          "minLength": 1,
          "description": "Public key encoded in hex or base64."
        }
      },
      "additionalProperties": false
    },
    "paymentOption": {
      "type": "object",
      "required": [
        "scheme",
        "network"
      ],
      "properties": {
        "scheme": {
          "type": "string",
          "enum": ["exact", "upto", "batch-settlement", "escrow"],
          "description": "The x402 payment and settlement scheme."
        },
        "network": {
          "type": "string",
          "pattern": "^[a-z0-9-]{3,8}:[-_a-zA-Z0-9]{1,32}$",
          "description": "Canonical CAIP-2 blockchain network identifier."
        },
        "asset": {
          "type": "string",
          "minLength": 1,
          "description": "Settlement asset contract address, currency code, or native symbol."
        },
        "amount": {
          "$ref": "#/definitions/atomicAmount"
        },
        "minAmount": {
          "$ref": "#/definitions/atomicAmount"
        },
        "maxAmount": {
          "$ref": "#/definitions/atomicAmount"
        },
        "recipient": {
          "type": "string",
          "description": "Authoritative payee address or account identifier."
        },
        "extra": {
          "type": "object",
          "description": "Optional scheme-specific parameters."
        }
      },
      "additionalProperties": false
    },
    "selfContainedResource": {
      "type": "object",
      "description": "Self-contained resource entry class: declares relative path and inline accepts[] payment options for single-fetch resolution without preliminary HTTP 402 roundtrips.",
      "required": [
        "path",
        "accepts"
      ],
      "properties": {
        "x402Version": {
          "$ref": "#/definitions/protocolVersion"
        },
        "path": {
          "type": "string",
          "minLength": 1,
          "description": "URL path or URI template of the monetized resource."
        },
        "description": {
          "type": "string",
          "description": "Human and agent readable summary of the resource."
        },
        "methods": {
          "type": "array",
          "items": {
            "type": "string",
            "enum": ["GET", "POST", "PUT", "DELETE", "PATCH", "HEAD", "OPTIONS"]
          },
          "minItems": 1,
          "uniqueItems": true,
          "description": "HTTP methods applicable to this payment requirement. Defaults to all methods if omitted."
        },
        "accepts": {
          "type": "array",
          "minItems": 1,
          "description": "Supported payment options for this endpoint.",
          "items": {
            "$ref": "#/definitions/paymentOption"
          }
        }
      },
      "additionalProperties": false
    },
    "pointerResource": {
      "description": "Pointer resource entry class: identifies a monetized endpoint by URL (and optional HTTP verb/description) where payment terms are discovered by fetching the live HTTP 402 challenge at the target URL.",
      "oneOf": [
        {
          "type": "string",
          "format": "uri",
          "minLength": 1
        },
        {
          "type": "object",
          "required": [
            "url"
          ],
          "properties": {
            "x402Version": {
              "$ref": "#/definitions/protocolVersion"
            },
            "url": {
              "type": "string",
              "format": "uri",
              "minLength": 1,
              "description": "Target URL of the monetized resource."
            },
            "method": {
              "type": "string",
              "enum": ["GET", "POST", "PUT", "DELETE", "PATCH", "HEAD", "OPTIONS"],
              "description": "Single HTTP method applicable to the pointer resource."
            },
            "methods": {
              "type": "array",
              "items": {
                "type": "string",
                "enum": ["GET", "POST", "PUT", "DELETE", "PATCH", "HEAD", "OPTIONS"]
              },
              "minItems": 1,
              "uniqueItems": true,
              "description": "HTTP methods applicable to the pointer resource."
            },
            "description": {
              "type": "string",
              "description": "Human and agent readable summary of the resource."
            }
          },
          "additionalProperties": false
        }
      ]
    },
    "resourceEndpoint": {
      "description": "Discriminated union of the two conforming resource entry classes: selfContainedResource ({path, accepts}) when 'path' or 'accepts' is present, and pointerResource ({url, method?} or URI string) otherwise. Overlapping shapes (e.g. carrying both path and url) are deterministically rejected.",
      "if": {
        "type": "object",
        "anyOf": [
          { "required": ["path"] },
          { "required": ["accepts"] }
        ]
      },
      "then": {
        "$ref": "#/definitions/selfContainedResource"
      },
      "else": {
        "$ref": "#/definitions/pointerResource"
      }
    }
  }
}
